{
  "schema_version": "1.0.0",
  "patch_id": "gold_key_015",
  "source_score_id": "score_019",
  "source_fingerprint": "sha256:422d0135f2a24239a475ad2468c8e740d189c140d6ee8669fd1c736980b96229",
  "instruction": "Change the key signature to G minor without transposing any note.",
  "target_scope": {
    "whole_score": true
  },
  "protected_scope": {},
  "preconditions": [],
  "operations": [
    {
      "operation_id": "key_015_op1",
      "type": "change_key_signature",
      "selector": {},
      "arguments": {
        "key": "G minor"
      },
      "preconditions": [],
      "expected_change_count": null
    }
  ],
  "expected_effects": [
    {
      "type": "key_equals",
      "value": "G minor"
    },
    {
      "type": "preserve_pitch"
    }
  ],
  "provenance": {
    "provider": "rule_template",
    "model": "deterministic_core_v1",
    "temperature": 0,
    "seed": 42
  }
}
