{
  "schema_version": "1.0.0",
  "patch_id": "gold_voice_007",
  "source_score_id": "score_013",
  "source_fingerprint": "sha256:9864ef2f688482eae2f17cce48bd795f7623014c6144397a76117f3f02df3caf",
  "instruction": "Move all notes in measure 3 staff 1 from voice 1 to voice 2, preserving pitch and rhythm.",
  "target_scope": {
    "measures": [
      3
    ],
    "staffs": [
      1
    ]
  },
  "protected_scope": {
    "staffs": [
      2
    ]
  },
  "preconditions": [],
  "operations": [
    {
      "operation_id": "voice_007_op1",
      "type": "move_to_voice",
      "selector": {
        "event_ids": [
          "s013_m3_rh_1",
          "s013_m3_rh_2",
          "s013_m3_rh_3",
          "s013_m3_rh_4"
        ]
      },
      "arguments": {
        "voice": 2
      },
      "preconditions": [],
      "expected_change_count": 4
    }
  ],
  "expected_effects": [
    {
      "type": "preserve_pitch"
    },
    {
      "type": "preserve_duration"
    }
  ],
  "provenance": {
    "provider": "rule_template",
    "model": "deterministic_core_v1",
    "temperature": 0,
    "seed": 42
  }
}
