{
  "schema_version": "1.0.0",
  "patch_id": "gold_ties_006",
  "source_score_id": "score_013",
  "source_fingerprint": "sha256:9864ef2f688482eae2f17cce48bd795f7623014c6144397a76117f3f02df3caf",
  "instruction": "Add one slur from the first to the last note of measure 3 staff 1.",
  "target_scope": {
    "measures": [
      3
    ],
    "staffs": [
      1
    ]
  },
  "protected_scope": {
    "staffs": [
      2
    ]
  },
  "preconditions": [],
  "operations": [
    {
      "operation_id": "ties_006_op1",
      "type": "set_slur",
      "selector": {
        "event_ids": [
          "s013_m3_rh_1"
        ]
      },
      "arguments": {
        "slur": "start"
      },
      "preconditions": [],
      "expected_change_count": 1
    },
    {
      "operation_id": "ties_006_op2",
      "type": "set_slur",
      "selector": {
        "event_ids": [
          "s013_m3_rh_4"
        ]
      },
      "arguments": {
        "slur": "stop"
      },
      "preconditions": [],
      "expected_change_count": 1
    }
  ],
  "expected_effects": [
    {
      "type": "preserve_pitch"
    },
    {
      "type": "preserve_duration"
    }
  ],
  "provenance": {
    "provider": "rule_template",
    "model": "deterministic_core_v1",
    "temperature": 0,
    "seed": 42
  }
}
