{
  "schema_version": "1.0.0",
  "patch_id": "gold_dynamics_006",
  "source_score_id": "score_006",
  "source_fingerprint": "sha256:32b61efb08725d79cd116bd9c36034c2608d26780282085a70cdfbfccdd6ca4a",
  "instruction": "Add staccato to only the selected note while preserving pitch and duration.",
  "target_scope": {
    "measures": [
      2
    ],
    "staffs": [
      1
    ],
    "event_ids": [
      "s006_m2_rh_3"
    ]
  },
  "protected_scope": {
    "staffs": [
      2
    ]
  },
  "preconditions": [],
  "operations": [
    {
      "operation_id": "dynamics_006_op1",
      "type": "set_articulation",
      "selector": {
        "event_ids": [
          "s006_m2_rh_3"
        ]
      },
      "arguments": {
        "articulations": [
          "staccato"
        ]
      },
      "preconditions": [],
      "expected_change_count": 1
    }
  ],
  "expected_effects": [
    {
      "type": "preserve_pitch"
    },
    {
      "type": "preserve_duration"
    }
  ],
  "provenance": {
    "provider": "rule_template",
    "model": "deterministic_core_v1",
    "temperature": 0,
    "seed": 42
  }
}
